Data component,Source or local file,Years,Locations,Measures or variables,Role in manuscript,Key limitation or note
GBD 2023 high-BMI-attributable NAFLD burden,A_highBMI_attr CSV,1990-2023,44 total; 34 country/territory locations for main analyses,"Deaths, DALYs; Number, Percent, Rate",Observed high-BMI-attributable burden and PAF anchor,Percent values are proportions in raw CSV and percentage points in display tables.
GBD 2023 total NAFLD burden,D_total_burden CSV,1990-2023,44 total,"Deaths, DALYs; Number, Percent, Rate",Total burden denominator and population proxy,Outcome reflects GBD NAFLD coding and does not fully remap to 2023 MASLD criteria.
High-BMI exposure package,E1 mean BMI plus overweight and obesity prevalence files,1990-2023,Country-level exposure package,"Mean BMI, overweight prevalence, obesity prevalence",Approximate exposure distribution for sex-equalized counterfactual,High-BMI-specific SEV was not available; all-risk SEV was not used.
GBD 2023 SDI,GBD2023_SDI_1950_2023 CSV,1990-2023,34 country/territory locations,Continuous SDI,Country-level descriptive SDI association,Ecological descriptive association; not causal.
High FPG and smoking attributable burden,B_highFPG_attr and C_smoking_attr CSVs,1990-2023,44 total; country level for comparison,"Deaths, DALYs; Number, Percent, Rate",Non-additive risk-factor comparison,Age floors differ by risk; comparison is standardized to common 30+ age range.
UN WPP 2024 population exposure,PopulationExposureByAge5GroupSex_Medium,2024-2050,34 matched locations,Person-years by sex and five-year age group,Future person-years for BAPC scenario projection,Projection remains a model scenario and not an IHME official forecast.
Natural Earth basemap,Natural Earth admin-0 countries shapefile,Not applicable,33/34 polygon matches; Tokelau via manual point,Map geometry only,Basemap for Figure 1,Basemap is not an analytical GBD dataset.
